d1428	He was born in Lunenburg, Nova Scotia, the son of John Christopher Rudolf and the grandson of one of Lunenburg's founders. He operated a store in Lunenburg and owned a number of ships which traded in goods from the West Indies. In 1824, he married Catherine Stevens . Rudolf served his community as justice of the peace, postmaster, registrar of deeds and lieutenant-colonel in the local militia. He married Anna Matilda Oxner in 1833 after the death of his first wife. In 1838, he was named to the Legislative Council, serving as a member until his death in Lunenburg at the age of 67. Although general conservative in politics, he supported measures in support of responsible government.
d1429	He died on February 2, 1974 in Montreal.
d1430	He was elected to Congress as a Republican to fill the vacancy caused by the resignation of John E. Reyburn. He was reelected to the 61st United States Congress and served from until his death in Philadelphia.
d1432	Leonetti died in 1979 in Houston, Texas, of cancer, at the age of 50. Gravestone name is ``Nicholas Tommy Leonetti''.
d1436	On his retirement in 1973, Fry and his wife moved from London to a cottage in Cotherstone, Co. Durham, where he died in 1987 at the age of 88.
d1437	Ludwika died of a plague during an 1855 epidemic, at her home in Warsaw.
d1438	Rouveyre died in December 1962 in Barbizon, France.
d1439	Straffen died at Frankland Prison in County Durham on 19 November 2007. He was 77 years old and had been in prison for a British record of 55 years. This left Moors Murderer Ian Brady (who had been in prison since October 1965 and was then in a mental hospital) as the longest-serving prisoner in Britain.
d1441	Longworth died in 1961 at Newcastle and was cremated with Congregational forms.
d1442	Hiram Shaw Wilkinson died in September 1926 in Tobermore.
d1443	Florentina Mallá (b. 14 July 1891, d. 7 June 1973) was a Czech composer and pianist. She studied piano with Josef Jiranek at the Prague Conservatory, graduating in 1913 and later studied composition privately with Vitezslav Novak. She suspended her work as a composer during the Communist years. Her works include didactic piano compositions, a sonatina and preludium for piano and about fifty songs. She died in Prague.
d1444	He died at Avignon in 1571.
d1445	He was born in L'Assomption, Lower Canada in 1825, the son of a farmer, and studied at the Petit Séminaire de Montréal and the Collège de L'Assomption. Papin articled in law with Joseph-Ferréol Pelletier and was called to the bar in 1846. He helped found the Institut canadien de Montréal in 1844 and served as president in 1847. Papin also contributed to the newspaper L'Avenir. Papin signed the Montreal Annexation Manifesto of 1849 and took part in the movement lobbying for the abolition of seigneurial tenure. He served on the municipal council for Montreal in 1853 and 1854. In 1854, he was elected to the Legislative Assembly of the Province of Canada for L'Assomption and supported the parti rouge. During his time in the assembly, he proposed the creation of a school system that was not based on religious denominations. He was defeated in 1858 and returned to the practice of law. He married Sophie, the daughter of Jean-Baptiste Homier, a member of the municipal council, in 1857. In 1858, he became counsel for the town of Montreal. He died of cancer at L'Assomption in 1862 and was buried at Montreal.
d1447	John Edward Underhill (1574-1608), grandson of Hugh Underhill and son of Thomas Underhill, despite being born in England would be among Puritan exiles who left for Bergen op Zoom, The Netherlands, where he died and was buried. Captain John Underhill, great-grandson of Hugh Underhill, would emigrate from England to The Netherlands with his family, and then from The Netherlands to the Massachusetts Bay Colony where be became a leading figure in Colonial America. Myron Charles Taylor, America's leading industrialist, and a key diplmatic figure at the hub of many of the most important geopolitical events before, during, and after World War II. Also eighth generation descended from Captain John Underhill. Amelia Earhart, American aviation pioneer and author famous for her mysterious disappearance.
d1448	In 1809, he was elected to the Legislative Assembly of Lower Canada for Hertford County. Governor James Henry Craig jailed him for sedition in 1810. However, Blanchet was reelected in that year and continued to hold a seat in the assembly until he was defeated in March 1816; Blanchet was reelected in a subsequent by-election and served until his death in Quebec City in 1830. He was a supporter and spokesperson for the parti Canadien in the assembly. He was named as a justice of the peace for Quebec district in 1815.
d1449	In 1978, at age 90, Berry died in a Rockport hospital. He had led an active, fruitful life, and thereby left the people of Maine with a body of work ``created with consummate skill and fidelity to their subjects'' (Hammond).
d1451	Van Horne was again elected to the Maryland House of Delegates and served from 1814 to 1816. He was then elected to the Maryland State Senate in 1816 and served until his death in Prince Georges County, Maryland.
d1452	After leaving Congress, Harris was appointed United States Attorney for the Northern District of Alabama under the new Clinton administration in 1993. Harris died on October 2, 1994 in Birmingham, Alabama.
d1453	Tate stood as an umpire in a single first-class match between Sussex and Hampshire. He died at Lyndhurst, Hampshire on April 24, 1935.
d1454	He died at Glyndebourne in 1962. After Christie's death, the festival was taken over by his son, Sir George Christie and recently his grandson Gus Christie. Like his father, Sir George was also made a Companion of Honour for his work at Glyndebourne.
d1455	When King Charles returned in May, he appointed Sir Orlando Bridgeman in his place as chief baron, but in consequence of his having assisted the lords in several committees of the Convention parliament, Wilde escaped further question, and, was not excluded from the general pardon in the Act of Indemnity. Aged 70 he retired to his house at Hampstead, where he died in 1669.
d1458	Tayler continued to live in Cardiff, where he and his uncle ran a tobacco manufacturing business, but settled later in his life in Devon, where he died at the age of 96.
d1459	O'Neill died of cirrhosis of the liver in his home in Jersey City on November 8, 1897.
d1460	He died on 1 August 2000 in Mumbai, and on his first death anniversary in 2001, a book ``Ali Sardar Jafri: The youthful boatman'' of joy was released.
d1462	Ritson spared no pains himself to ensure accuracy in the texts of old songs, ballads and metrical romances which he edited. His collection of the Robin Hood ballads is perhaps his greatest single achievement. Sir Walter Scott, who admired his industry and accuracy in spite of his temper, was almost the only man who could get on with him. According to Scott, Ritson was ``a man of acute observation, profound research, and great labour.'' On one occasion, when he called in Scott's absence, he spoke so rudely to his wife that he was threatened with being thrown out of the window. Spelling was one of his eccentricities, his own name being an example: Ritson is short for Richardson. As early as 1796, Ritson showed signs of mental collapse, and on 10 September 1803 he became completely insane, barricaded himself in his chambers at Gray's Inn, made a bonfire of manuscripts, and was finally forcibly removed to Hoxton, where he died.
d1463	Roman Zenzinger died on 5 November 1990 in Vienna.
d1465	Caccini died at Rome in 1613.
d1466	Born in Bronx, New York, Duberstein graduated from Brooklyn College in 1938, and received a J.D. from St. John's University School of Law in 1942. He served in the United States Army during World War II, from 1943 to 1945, in the 91st Infantry Division of the 5th Army, serving in combat in Italy. His military honors included a Bronze Star Medal, a Purple Heart, and a Combat Infantryman Badge. Following the war, he was in private practice in the area of bankruptcy until 1981, first with Schwartz, Rudin and Duberstein, and then with Otterbourg, Steindler, Houston and Rosen. In 1981, he began his service in the federal bankruptcy court, where he was Chief Judge for over twenty years, from 1984 until his death, in 2005, in New York.
d1467	He died in 1989 in Los Angeles, California, leaving a widow, Judy Kessler Hayes.
d1470	He became professor at the Academy of Sedan (1625), pastor at Maastricht (1632), pastor and professor at Bois-le-Duc (1636), and at Groningen (1643). He won a reputation that led to calls to Saumur, Marburg, Lausanne, and Leiden. He died at Groningen on May 18, 1673.
d1471	He was under suspicion after Monmouth's rebellion in 1685, and was lodged in Chester Castle, but was soon released, and on James II's progress to Shrewsbury in September 1686 he joined in the presentation to him of a purse of gold in recognition of the Indulgence. He died at Shrewsbury on 11 April 1708, aged nearly eighty-nine, and was buried on the 15th in St. Mary's Church. He composed his own epitaph.
d1472	He died at Barfold after a short illness on 24 November 1884, and was survived by 9 children.
d1473	He was born in Gloucester, Gloucestershire, England in 1790 and arrived in Upper Canada around 1816. He represented Oxford in the Legislative Assembly of Upper Canada from 1834 to 1841 as a Reformer. He served in the local militia but was dismissed in 1838. He was arrested after the Upper Canada Rebellion but later released because there was insufficient evidence of any wrongdoing. He left the country and moved to Texas where he died of yellow fever in 1840.
d1474	By 1722 Belissen settled in Marseille, where he succeeded Antoine Blanchard as maître de musique of the Abbey of St. Victor, which was then rapidly declining in importance--but he also secured a position directing the city's Académie de Concerts. Belissen remained in Marseilles until his death.
d1476	He died in 1871 in Corsham, Wiltshire.
d1477	Williamson died at Cobham, Kent, on 3 October 1701. He had become very rich by taking advantage of the many opportunities of making money which his official position gave him. He left £6,000 and his library to Queen's College, Oxford; £5,000 to found a school at Rochester, Sir Joseph Williamson's Mathematical School; and £2,000 to Thetford. A great number of Williamson's letters, dispatches, memoranda, etc., are among the English state papers. He has been described as one of the great English civil servants of his time and credited with building up an intelligence service which rivaled that of John Thurloe under Cromwell.
d1478	Foster was elected as a Democrat to the Fifty-sixth, Fifty-seventh, and Fifty-eighth Congresses (March 4, 1899-March 3, 1905). He was an unsuccessful candidate for reelection in 1904. He resumed the practice of law. He served as assistant corporation counsel of Chicago from 1912 to 1922. He retired from active pursuits in 1928 and moved to Wheaton, Illinois, where he died November 11, 1928. He was interred in Calvary Cemetery in Chicago.
d1479	Bishop Hodapp died at Methodist Hospital in Indianapolis, aged 82. He was survived by his wife and two daughters.
d1480	McGillycuddy died at age 90 in Berkeley, California. His ashes are entombed at the top of Harney Peak behind a plaque that reads ``Valentine McGillycuddy, Wasitu Wacan (Lakota: translates as Holy White Man).''
d1482	Lanson died in 1990 at age 76 in New York. He was survived by his widow, a daughter, two sons and eight grandchildren.
d1483	Henry died in 1792 at Raby Castle and was buried there.
d1486	In later years he devoted himself largely to petrology, and published memoirs on the trachytes of Hungary and Transylvania; on a new method of determining the species of feldspars in rocks, depending on fusibility and flame-coloration; on the geology and petrology of the district of Schemnitz; and on Santorin Island. He died at Budapest on the 12th of April 1894.
d1487	After Plater's congressional service he resumed the private practice of law. He later moved to Poolesville in Montgomery County, Maryland, where he died in 1830.
d1488	After she separated from her husband, Cynthia took their two youngest daughters, ``Nellie'' (Helen, aka Lillian Russell) and Suzanne, to New York City to launch the girls' musical careers and to broaden her own political horizons. There she organized the Science of Life Club and in 1880 managed a benefit for starving women and children in Ireland. In 1888, she became the first woman to run for mayor of New York City. She died in New Jersey in 1908.
d1489	After Abraham's death in 1985, she continued their joint line of work in co-operation with Abraham's nephew, Nicolas Rand, until her death in New York in 1998.
d1491	George Carter, an artist of considerable merit, was born at Colchester. He was an exhibitor at the Royal Academy in 1775, when he sent 'A Wounded Hussar on the Field of Battle. ' He afterwards painted 'The Dying Pilgrim,' 'The Siege of Gibraltar,' and many portraits. He is known as the painter of 'The Death of Captain Cook,' 'The Fisherman's Return,' and other popular works, which have been engraved. He died at Hendon in 1795.
d1492	Strang was an active member of the Fine Arts Association, Palette and Brush club and belonged to the Salmagundi Club of New York City. He had a ranch near Safford Peak in the Picture Rocks section of the Tucson Mountains, where he died in 1957.
d1495	Diego de Arroyo, a miniature painter, who was born at Toledo in 1498, is supposed to have studied either in Italy or under an Italian master. His delicate miniature portraits gained him much renown, and the appointment of painter to Charles V. He also illuminated choir-books for the cathedral of Toledo. Arroyo died at Madrid in 1551.
d1497	Henry Fletcher Hance (1827--1886) was a British diplomat who devoted his spare time to the study of Chinese plants. Born in London, his first appointment was to Hong Kong in 1844; he later became vice-consul to Whampoa, consul to Canton, and finally consul to Xiamen, where he died in 1886. In 1873, Hance published a supplement to George Bentham's 1861 Flora Hongkongensis. http://asaweb.huh.harvard.edu:8080/databases/botanists?id=145776
d1499	Deutsch sold the Tube Bar in 1980, and retired to Pompano Beach, Florida, where he died three years later at the age of 87.
d1500	Catherine was involved in many worthy causes including serving for many years as president of the Woman's Foreign Missionary Society of the Presbyterian Church. She died in Toronto, Canada.
d1501	Tibor Feheregyhazi died at age 75 in Saskatoon following a lengthy battle with prostate cancer.
d1502	He was a poet and a member of the Gorsedd of Bards at the National Eisteddfod of Wales and served as President of the International Eisteddfod at Llangollen. Lord Maelor, a lifelong heavy smoker, died in an overnight fire at his home in Ponciau in 1984 which was thought to be started by a smouldering cigarette.
d1503	Robert MacBryde died in 1966 in Dublin as a result of a street accident. Anthony Cronin, a friend of MacBryde and Colquhoun, describes them both with affection and respect in his memoir Dead as Doornails.
d1504	Plantz became president of Lawrence University in 1894, and served until his death on November 14, 1924, in Sturgeon Bay, WI. During his tenure, the student body increased from 200 to 800 and the number of faculty from nine to 68. Numerous campus buildings were also erected during his presidency, including the prominent Chapel. Plantz Hall, built in 1961, is named for him.
d1505	King was born at Newport, Monmouthshire, and entered Trinity College, Cambridge, in 1836. He graduated in 1840, and obtained a fellowship in 1842. He was a senior fellow at the time of his death in London.
d1506	She was married to the economist Paul Sweezy, whom she divorced in 1960. She died in Cambridge, Massachusetts on February 6, 2010.
d1507	Gorriti was made governor of Salta Province in 1822 and served with distinction, having a second term between 1827 and 1829. He had several further military successes both against Spanish forces and against the Federals under Juan Facundo Quiroga. Quiroga's later success, however, obliged him to go in exile to Bolivia, where he died penniless with many children.
d1508	Colin John McRae (October 22, 1812--1877) was a prominent Confederate politician. He was born in Anson County, North Carolina and later moved to Mississippi where he served in the state legislature in 1838. Afterwards he moved to Alabama and was elected to serve the state in the Provisional Confederate Congress from 1861 to 1862. After the war he moved to Belize, where he died.
d1509	In 1867, he was elected to the Canadian House of Commons for the riding of Halifax. One of 18 members elected of the Anti-Confederation Party, he became an independent in 1869 and was defeated in 1872. He was re-elected in 1874 but was forced to resign in 1878 due to an alleged breach of the Independence of Parliament Act. He was re-elected in the resulting 1878 by-election and was appointed Minister of Militia and Defence from January to October. He was defeated in the 1878 election and in 1882. He was re-elected in 1887 as a Liberal but was defeated in 1891. From 1900 until his death in Halifax in 1906, he was the Lieutenant-Governor of Nova Scotia.
d1510	Hi Jolly or Hadji Ali (Arabic: حاج علي Ḥājj ''Alī; ), later known as Philip Tedro (born ''Ali al-Hajaya 1828-- December 16, 1902), was an Ottoman subject of Jordanian parentage, and in 1856 became one of the first camel drivers ever hired by the US Army to lead the camel driver experiment in the Southwest. Hi Jolly became a living legend until his death in Arizona. Once, insulted because he had not been invited to a German picnic in Los Angeles, he broke up the gathering by driving into it on a yellow cart pulled by two of his pet camels.
d1511	Edward F. Cavanagh Jr. (August 18, 1906 -- June 17, 1986) was appointed the 18th Fire Commissioner of the City of New York by Mayor Robert F. Wagner on January 1, 1954 and served in that position until his resignation on December 31, 1961. He died in 1986 at Morristown Memorial Hospital in Morristown, New Jersey.
d1512	Bannenberg died of an inoperable Brain tumour at his home in London in 2002.
d1513	Collin McKinney died at his home in Collin County on September 9, 1861 and was buried in the nearby Van Alstyne, Texas Cemetery in the McKinney family plot which was originally the homeplace of Younger Scott McKinney. A historical marker erected by the Texas Historical Commission honors this Texan who lived for over 95 years under the flags of seven different nations.
d1514	His younger brother Christian Friedrich Ezdorf (1807-1858) was also a landscape painter. He was educated in art at the Munich Academy, and at first practised porcelain painting, but afterwards devoted himself to landscapes, in which he followed much the same style as his brother, producing forest scenes, rooky valleys, and winter pieces. After his brother's death he returned for a while to Pösneck, but afterwards took to the business of tanning, and settled first in Kissingen and finally in Würzburg, where he died in 1858. Besides his paintings he has left eighteen etchings of landscapes, mostly after his brother, and one lithograph.
d1515	In 1857 Thomson was elected member for Geelong in the Victorian legislative assembly but retired in April 1859. His many activities had led to the neglect of his own financial affairs, and towards the end of his life he accepted the position of medical officer to the Sunbury boys' home. He died at Geelong on 1 January 1866 and was buried in the old Geelong cemetery. His wife and a daughter survived him.
d1516	He was born in Saint-Thomas-de-la-Pointe-à-la-Caille, Lower Canada, the son of Jean-Baptiste Bernatchez and Marie Talbot dit Gervais, and was educated in Montmagny. In 1859, he married Henriette Couillard Després. Bernatchez was postmaster at Montmagny and was mayor of Saint-Thomas-de-la-Pointe-à-la-Caille and warden for Montmagny County from 1877 to 1883. He also operated a shipping company linking Montmagny and Quebec City. Bernatchez was defeated in 1881 by Louis-Napoléon Fortin, but he was declared elected by the Quebec Superior Court in 1883. He was reelected in 1886, 1890 and 1892, but was defeated by Joseph-Couillard Lislois when he ran for reelection in 1897. Bernatchez served as governor for the prison at Quebec City from 1897 until his death in Quebec City in 1906. He was buried in Montmagny.
d1517	Julius was involved in the legal case regarding Menzies' attempted dissolution of the Communist Party in 1950--51, and in 1954--55 he cross-examined the Petrovs at the royal commission on espionage. He was also a supporter of the peace movement and Aboriginal rights. On 16 February 1960, under financial difficulties, he had himself removed from the roll of barristers and became a solicitor. Julius died at Princess Alexandra Hospital in South Brisbane on 27 February 1963 of myocardial infarction and was cremated.
d1518	Born in Peterhead, Scotland,the son of William Gibson and Lucretia Gilzean, he was educated in Scotland and came to Canada in 1870. Gibson was a contractor and engineer involved in the construction of the St. Clair Tunnel, the Welland Canal, the Victoria Bridge and several bridges on the Grand Trunk Railway. He operated a limestone quarry near Beamsville, Ontario and was also president of the Bank of Hamilton, the Hamilton Gaslight Company and the Keewatin Power Company. On 11 February 1902, he was appointed to the Senate of Canada, a position which he held until his death in Beamsville at the age of 64.
d1519	He died from liver disease, at Surbiton, on 22 January 1880. He was the writer of The Drainage of Calcutta, 1871.
d1521	He was born in Clonakilty, County Cork, the son of Daniel J. Callanan, and was educated at the University of Dublin and in Paris. From 1875 to 1873, he practised in Kilbrittain and Rosscarbery. He came to Canada, settling in the Northwest Territories. Later, Callanan practised in Nanaimo and Victoria for eight years before moving to Quesnel in 1894 and Barkerville in 1899. Callanan was a physician for the Royal Cariboo Hospital in Barkerville. In 1885, he married Hannah Healy. He retired to New Westminster in 1922. Callanan died at St. Mary's Hospital in New Westminster after an extended illness.
d1522	Svetlova's accomplishments as a ballerina were later eclipsed by her second career as a dance teacher and choreographer at the Southern Vermont Art Center (1959--64); the Svetlova Dance Center in Dorset, VT (1965--95); and Indiana University where she was professor of ballet and chairwoman of the ballet department (1969--92). She died in Bloomington, Indiana in 2009.
d1523	After seventeen years in the United States of America, Rafael Pombo returned to Colombia, where he worked as a celebrated translator and journalist (founding several newspapers). On August 20, 1905 he was crowned as Colombia's best poet - his Poesías Completas was published in 1957, from which the poem ''En El Niágara'' was taken. Rafael Pombo remained in Colombia until his death on May 5, 1912.
d1525	Damon died of cancer at Beth Israel Medical Center in Newark, New Jersey at age 51.
d1526	Hamilton was on death row at the San Quentin State Prison in California where he died of natural causes on October 22, 2007 at the age of 57.
d1527	Brown died in June 1956 in Lawton, Oklahoma, due to drug addiction.
d1528	The Chicago-born Ruth Hartman emigrated to Canada in 1925 when she married Egmont Leo Frankel (d. 1964). She died in Toronto, predeceased by one of her three children.
d1532	Born at Llucmajor on the island of Mallorca, Spain in 1776. Boscana was educated at Palma and joined the Franciscan order in 1792. He traveled to Mexico in 1803 and to California in 1806. He served at Mission Nuestra Señora de la Soledad (Soledad Mission), Mission La Purísima Concepción (La Purísima Mission), Mission San Luis Rey de Francia (San Luis Rey Mission & Luiseño 'Mission Indians'), and Mission San Gabriel Arcángel (San Gabriel Mission & Gabrieliño--Tongva 'Mission Indians'). For more than a decade, from 1812--1826, he was stationed at Mission San Juan Capistrano. He died at Mission San Gabriel in 1831, and is the only missionary to be interred in its cemetery among over 2,000 other mission inhabitants, mainly Tongva-Gabrielino Indians, buried there.
d1534	Mr. Veitch died at the age of 85 at the Winthrop Hospital in Mineola, Long Island, New York in February 1996 after a brief illness. His son, John M. Veitch, is also a successful trainer.
d1535	John Tombs was son of a banker, Joseph Tombs (1745--1818), of Abingdon. Graduating from Abingdon School, John Tombs entered service with the East India Company. He commanded the 3rd Bengal Cavalry at the siege of Bharatpur (1824--25) and was promoted Major-General in 1838. He retired from the Indian Army to Malta where he died. He sent his six sons home to Abingdon for an English education, the most distinguished of them being the sixth son, Major-General Sir Henry Tombs, VC, KCB (1825--1874).
d1536	He died on June 24, 1971 in Montreal.
d1537	John McFarlane died suddenly on 9 July 1915, at his home in Marrickville. His funeral was held in the Presbyterian cemetery at Rookwood, Sydney.
d1539	Rosenbach was born in Grohnde an der Weser on December 16, 1842. Rosenbach studied in Heidelberg, Göttingen, Vienna, Paris, and Berlin. He obtained his doctorate in 1867. He married Franziska Merkel on May 12, 1877. Rosenbach died on December 6, 1923 in Göttingen.
d1540	In February 1988, Fuller died at Blodgett Memorial Medical Center in Grand Rapids, Michigan.
