d2229	Briggs was born at Norwich, for which city his father, Augustine Briggs, was four times M.P. At thirteen he was entered at Corpus Christi, Cambridge, under Thomas Tenison, became a fellow of his college in 1668, and M.A. in 1670. After some years spent in tuition and in studying medicine, he went to France and attended the lectures of Raymond Vieussens at Montpellier, under the patronage of Ralph Montagu (afterwards Duke of Montagu), then British ambassador to France. To him Briggs dedicated his Ophthalmographia, an anatomical description of the eye, published at Cambridge in 1676, on his return from France. He proceeded M.D. at Cambridge in 1677, and was elected a fellow of the London College of Physicians in 1682. In the latter year the first part of his Theory of Vision was published by Robert Hooke (Philosophical Collections, No. 6, p. 167); the second part was published in the Philosophical Transactions in 1683. The Theory of Vision was translated into Latin, and published in 1685 by desire of Sir Isaac Newton, who wrote a commendatory preface to it, acknowledging the benefit he had derived from Briggs's anatomical skill and knowledge. A second edition of the Ophthalmographia was published in 1687. Several points in Briggs's account of the eye are noteworthy, one being his recognition of the retina as an expansion in which the fibres of the optic nerve are spread out ; another, his laying emphasis upon the hypothesis of vibrations as an explanation of the phenomena of nervous action. Briggs practised with great success in London, especially in diseases of the eye ; was physician to St. Thomas's Hospital 1682-9, physician in ordinary to William III of England from 1696, and censor of the College of Physicians in 1685, 1686, 1692. In 1689, according to a curious memorial on one sheet preserved in the British Museum, Dr. Briggs was at great expense in vindicating the title of the crown to St. Thomas's Hospital, but was himself dismissed from his post, owing, as he states, to the machinations of a rival physician. From the same sheet we learn that, although he attended the royal household with great zeal for five years, he could get no pay ; and notwithstanding that in 1698 William III promised that he should be considered, this was of no avail. In consequence of these circumstances, apparently early in Anne's reign, he begs for consideration in regard to the hospital appointment. He died 4 Sept. 1704, at Town Malling in Kent. His son, Henry Briggs, chaplain to George II, and rector of Holt, Norfolk, erected a cenotaph to his father's memory in Holt church in 1737. The inscription is quoted by Munk. His portrait, by R. White, was engraved by Faber.
d2232	In his seventy-second year he commenced to study Turkish, and started for the East on 15 June 1858. After some work in Constantinople, and while waiting for his equipments and tents to proceed to the interior of Asia Minor, Yeardley was smitten with paralysis at Isnik, and was compelled to return to England, where he died on 11 August 1858. He was buried at Stoke Newington on the 18th.
d2234	Arthur E. Powell was born at ``Plas-y-Bryn,'' a house located in Llanllwchiairn ( near Newtown ), Montgomeryshire, Wales. He later emigrated to the United States, where he died in Los Angeles, California in 1969. Arthur's parents were Edward Powell ( 1850-1918 ) and Mary Eleanor Pughe Pryce-Jones ( 1859-1944 ), who married on June 3, 1880. Arthur's father Edward Powell was a solicitor, and Chairman of the Board and Managing Director of the Humber-Hillman Company ( an automobile manufacturer ). Arthur married twice, his first wife being Hilda ( surname not known ), and his second wife being Winifred May Fenwick.
d2235	Barrett retired in 1940. She died in Hampton on 27 August 1948.
d2236	Jewitt had read largely from youth, and now opened a private school. In 1794 he became master of a school at Chesterfield, and after several removals and changes was master of the Kimberworth school from 1814 to 1818, when he retired from educational work and removed to Duffield near Derby. There he remained until 1838, when he joined some of his family at Headington, near Oxford. He died at Headington on his birthday, 7 March 1852. His wife died at Duffield in November 1835. Two of his seven sons were Llewellyn Jewitt (1816--1886) and Orlando Jewitt (1799--1869).
d2237	Robison was elected as an Opposition Party candidate to the Thirty-fourth Congress. He was not a candidate for renomination and continued to practice law in Chambersburg, where he died in 1859, from a disease contracted at a banquet at the National Hotel in Washington, D.C., during the inauguration of President James Buchanan. The illness was known as National Hotel disease. He was buried in Cedar Hill Cemetery in Greencastle.
d2238	In 1977, Smyth was instrumental in the formation of the Professional Referees' Association, and was PRA president at the time of his death in 2007. He died of cancer at the age of 78 on 4 January 2007 at his home in Chesterfield.
d2239	Mubarek, who was trying to sleep ahead of his release the following morning, complained the light in the cell was too bright; Stewart allegedly responded to this by throwing a pair of underpants over the cell lamp. At 3.35am on the morning of March 21, Stewart allegedly took a table leg that he had already separated from the table and began battering his cellmate over the head. Mubarek was hit between seven and eleven times before Stewart pressed the alarm and waited for the prison officers to arrive. Once they did, he was immediately moved to a nearby cell where he washed his blood-stained hands and clothes before a forensic team could isolate any evidence. All the while, Mubarek was on his way to Charing Cross Hospital in west London, where he died.
d2240	In 1711, being very ill, Aveneau retired to Quebec. A 500-km canoe trip by a man who was already exhausted was an unfortunate necessity. He died at Quebec on September 14, 1711. Father Joseph Germain, superior general of the Canadian missions, wrote an account of his life in which he praised his patience, his courage, and his charity towards friend and foe alike. Point Abino, Ontario, halfway between Fort Erie and Port Colborne, is named for him.
d2243	After a prolonged illness, Okilo died at the age of 74 in Yenagoa, Bayelsa State on 5 July 2008.
d2244	Cole died of dropsy at age 37 at her London home.
d2245	He was born in Jedburgh and came to Lower Canada in 1784. He established himself as a merchant and butcher at Quebec City. Anderson supplied the army and navy and also invested in real estate. In 1794, he married Margaret Jefferys. He served as quartermaster during the War of 1812. Anderson served in the militia, reaching the rank of captain, and was also a justice of the peace. Anderson was a director for the Savings Bank of Quebec. He voted against the Ninety-Two Resolutions. Anderson died at Quebec City at the age of 79.
d2246	Deutsch died at his home in Cincinnati. He was mourned by Jew and non-Jew, progressive and conservative; thousands filled the Cincinnati Crematory to pay their last respects.
d2247	After the War he was appointed General Officer Commanding Mesopotamia 1920 remaining in that post until 1922; he retired in 1925. Haldane died on 19 April 1950, at his home in London and was buried at Brookwood Cemetery.
d2248	Shortly after the publication of this last piece Breval died at Paris, January 1738.
d2249	He died on 24 January 1957 in Gottingen, Germany.
d2250	He left Bletchley in November 1767, and on Lady day in the following year he very honourably resigned the rectory in favour of Browne Willis's grandson, the Rev. Thomas Willis, merely because he knew it was his patron's intention so to bestow the living if he had lived to effect an exchange. Cole now went into a hired house at Waterbeach, five miles from Cambridge. This house, little better than a cottage, was very uncomfortable. To make matters worse, he discovered that he had got into a parish which abounded with fanatics of almost all denominations. Writing about this period to his friend Father Charles Bonaventure Bedingfeld, a Minorite friar, he says: ``My finances are miserably reduced by quitting the living of Bletchley, and by half my own estate being under water by the breaking of the Bedford river bank at Over after the great snow in February was twelvemonth;'' and he proceeds to remark: ``Yet I am not disposed to engage myself in any ecclesiastical matters again, except greater should be offered than I am in expectation of. I have already refused two livings, one in Glamorganshire, the other in Oxfordshire; for I have no inclination to the duty and do not love to be confined.'' He still had a hankering after a semi-monastic life, for he wrote to Bedingfeld on 20 April 1768: ``Could I have my books and conveniences about me, I should nowhere like better than to finish my days among my countrymen in a conventual manner,'' though not, he takes care to explain, as a monk or friar, because he had no religious vocation. A second overflow of the Hundred Foot river at Over still further diminished the value of his estate, and on 18 February 1769 he wrote to the Rev. John Allen: ``I hardly ever now really enjoy myself for three days together, as the continued wet weather alarms me constantly; so that I am come to a resolution to sell my estate and purchase elsewhere, or buy an annuity.'' At Michaelmas 1769 he had his first attack of gout, which complaint afterwards caused him severe and frequent suffering. About May 1770 he removed from Waterbeach to a small house at Milton,near Cambridge. Here he spent the remainder of his days, and was familiarly distinguished as ``Cole of Milton,'' though he was sometimes spoken of jocularly as ``Cardinal Cole.'' In May 1771, by Lord Montfort's favour, he was put into the commission of the peace for the borough of Cambridge. In the following year Bishop Keene, without any solicitation, sent him an offer of the vicarage of Madingley, but he civilly declined it. He was, however, on 10 June 1774 instituted by Dr. John Green, bishop of Lincoln, on the presentation of Eton College, to the vicarage of Burnham, Buckinghamshire, vacant by the cession of his uterine brother, Stephen Apthorp, D.D. He still continued to reside at Milton, where he died on 16 December 1782, his constitution having been shattered by repeated attacks of gout. He lies buried in St. Clement's Church, Cambridge, under the steeple, which bears on its front his motto, Deum Cole. On the right hand of the entrance to the church is a monument, with an inscription stating that the steeple was erected with money left by him for the purpose,
d2251	Bobby Poe died at his home in Grove, Oklahoma on January 22, 2011. He had been diagnosed with throat cancer in 2009. While he was able to beat the cancer, he grew steadily weaker during his recovery and suffered a fatal blood clot on the aforementioned date.
d2252	Keith Kingbay remained a lifelong cyclist. He died on January 16, 1995 in Denver, Colorado.
d2253	In April 2002 Gould's son, sociologist Roger V. Gould died of leukemia. One month later, Gould herself died of cancer at age 70 at Memorial Sloan-Kettering Cancer Center in Manhattan.
d2255	She died of kidney disease in March 1950 in Kansas City, at the age of 59.
d2258	Wilmer Fields died of a heart ailment at his home in Manassas, Virginia. He was 81.
d2259	Amon Bazira (1944--1993) was a Pan-Africanist leader and organiser who created an extensive intelligence network that was a clandestine component of the struggle to end the regime of Ugandan military dictator and president, Idi Amin. After helping to remove Idi Amin, Bazira served as Deputy Director of intelligence, and then as Director of Intelligence in Uganda in 1979. He produced a government report predicting that there would be a massive genocide in Rwanda that would lead to the collapse of order in Central and Eastern Africa, and proposed granting citizenship to Rwandan refugees and other displaced Africans in Uganda, as a means of preventing genocidal warfare. In August 1993, Amon Bazira was assassinated in Kenya at Nakuru, allegedly with the complicity of Tiny Rowland, Yoweri Museveni and Daniel arap Moi. Bazira's Pan African ideas and efforts helped in the creation of the African Unification Front, which has advanced the cause of Pan Africanism.
d2261	On August 17, 1996, while vacationing at his summer home, Baltzell was stricken with chest pains and hospitalized at Hyannis, then moved to Boston, where he died at Brigham and Women's Hospital at the age of 80. Baltzell's first wife, the artist Jane Piper, had died in 1991. He was survived by two daughters, Eve and Jan Baltzell, his second wife, Jocelyn Carlson Baltzell, and two stepdaughters Justina Carlton and Julie Carlson Groves. He was also survived by a brother, Dr. William Hewson Baltzell, IV, and a niece Baltzell and two nephews.
d2262	Christina Bellin died of a brain tumor at her Manhattan home in 1988. She was 50-years-old. She was survived by two sons, Marco and Andy, a sister, Francesca, and her mother, all of Manhattan. Her funeral was held at St. James Church at Madison Avenue and 71st Street in Manhattan.
d2263	He died at Napanee in 1863.
d2265	Bernardin suffered a series of strokes later in his life. He died of stroke on December 22, 2009, at Community Hospital of the Monterey Peninsula in Monterey, California, at the age of 81. He was survived by his wife, Joan Bernardin, two children, Kirsten and Mark, three stepchildren, Dan Ryan, Julie Bullas, Kristie Ryan and ten grandchildren.
d2267	Eliza was one of the three known daughters of Edward Clement (died 1794), a Rotherhithe shipwright. She died in Calcutta in 1816. Her mother died in or before 1783. Very little is known of her family. One of her sisters, Eleanor, married Thomas W. Preston.
d2268	Born in County Antrim, Ireland, he was brought to Canada as an infant. Ross married twice, first to Margaret Crawford who died in 1847, secondly to Augusta Elizabeth Baldwin 4 February 1851, the daughter of Robert Baldwin. Ross was president of the Grand Trunk Railway from 1853-1862 when he was succeeded by Sir Edward William Watkin. In 1867, he was appointed to the Senate representing the senatorial division of Ontario. A Conservative, the Honourable John Ross served until his death in 1871 in Toronto, Ontario. Ross' son, Robert Baldwin Ross would have a long-term relationship with Oscar Wilde.
d2269	Masakazu Yoshizawa died at his home in San Gabriel, California, of stomach cancer on October 24, 2007. He was survived by a daughter, Chrissy; his son, James; a sister, Chieko; and a granddaughter. He was a divorcee.
d2270	Feilden died at his home in Burwash in 1921, aged 83, about one year after his wife. He had no children.
d2271	Ihor Ševčenko (1922--2009) was a Polish-born philologist and historian of Ukrainian origin. He died 26 December 2009 in Cambridge, MA. A memorial website, where remembrances can be posted, has been established at https://sites.google.com/site/ihorsevcenko/home
d2273	Until 1864 he resided principally on Killiney Hill, overlooking Dublin Bay. The delicate health of some members of his family then rendered a change of climate imperative, and he paid a prolonged visit to continental Europe. On his return MacCarthy settled in London, where he published - in addition to his translations - Shelley's Early Life, which contains an account of that poet's visit to Dublin in 1812. MacCarthy had already resettled in his native land of Ireland for some months, when he died on Good Friday, 1882 at Blackrock, Dublin. His poetical gifts were inherited by his daughter, who became a nun, and wrote as Sister Mary Stanislaus.
d2274	In 1986 Waldman received the Motion Picture Screen Cartoonists Award, and in 1997 was given the Winsor McCay Award for his lifetime work in the field of animation. Waldman died of congestive heart failure at the age of 97 in Bethpage, New York.
d2277	Anderson Brown died April 25, 1923 in Rhinelander, Wisconsin.
d2278	Herlin died of a heart attack at age 68, at his home in southern France on December 20, 1994.
d2280	Marvin was elected as a Whig to the Thirtieth Congress (March 4, 1847 -- March 3, 1849). He resumed practice of law in Ripley, New York, where he died June 25, 1856. He was interred in East Ripley Cemetery.
d2281	James I continued Wotton in the office of comptroller, and on 13 Mar created him Baron Wotton of Marley, co. Kent. In November he was one of the lords who tried Sir Walter Raleigh. During the early years of James I's reign Wotton was lord-lieutenant of Kent, but in August 1610 he was sent as ambassador extraordinary to France to congratulate Louis XIII on his accession. On his return in October he brought Isaac Casaubon to England in his suite. In June 1612 he was nominated commissioner of the treasury on Salisbury's death. In November 1616 he was made treasurer of the household, but on 23 Dec. 1617 he was ``persuaded'' to retire from that office by the payment of five thousand pounds. This did not satisfy him, and he clung to office some weeks longer in the vain hope of extracting a viscountancy as a further compensation. He was excluded from the council on Charles I's accession on the ground of being a catholic. He retired to Boughton Malherbe, where he died early in 1626; the inquisitio post mortem was taken on 12 April.
d2283	In later years, Jennie Tourel devoted herself to recitals and orchestra engagements, excelling particularly in French repertoire. She also taught at the Juilliard School of Music in New York, and at the Aspen School of Music in Colorado. Her last opera performance was as Doña Marta in the world premiere of Thomas Pasatieri's Black Widow at the Seattle Opera in 1972. She died on November 23, 1973, in New York City.
d2284	Dame Mary Daly died at Fitzroy, Victoria, aged 86, on 11 June 1983.
d2285	Crebs engaged in the practice of his profession until his death in Carmi, Illinois, on June 26, 1890. He was interred in Maple Ridge Cemetery.
d2286	She died in Lambeth, London, aged 33.
d2287	He died at Wineham, Henfield in 1949, aged 70.
d2288	Mário de Ascenção Palmério was an Brazilian politician and writer, who was born in Monte Carmelo, state of Minas Gerais, on March 1, 1916. He died at Uberaba, state of Minas Gerais, in 1996.
d2289	She died on October 4, 2009 in Rochester, New York, aged 87, from ovarian cancer.
d2290	Stewart died at his home in Oakland on April 17, 1942, at the age of 61. He was survived by his wife and five children.
d2291	Atkinson died on August 8, 1899 in Newnan, Georgia, aged 44. He is buried in Oak Hill Cemetery in that city.
d2292	He was born in Annapolis Royal, Nova Scotia, the son of Edward How and Marie-Madeleine Winniett. Howe served as a lieutenant with the British army in Jamaica, England and Ireland. He married Helen McKellar Bontein in 1778. In 1783, he returned to Granville, Nova Scotia and began farming. He was first declared elected to the provincial assembly after appealing two consecutive elections. Howe also served as justice of the peace and judge in the Inferior Court of Common Pleas for Annapolis County. He was named captain in the Royal Nova Scotia Regiment and also was superintendent of Jamaican maroons. After he was replaced in that post, he moved to Prince Edward Island in 1802 where he served as assistant commissary and storekeeper. Howe also served on the colony's Council and was a justice of the peace there. In 1803, he married Margaret Ann Green, the granddaughter of Benjamin Green. After two of his sons died accidentally and he suffered financial losses, Howe returned to Nova Scotia where he died in Dartmouth at the age of 63.
d2293	Together with Jacob Israel Belmonte and Samuel Palache, Tirado founded the Spanish-Portuguese community of Amsterdam, being its first president. Having acquired a house on the Houtgracht, he transformed it into a synagogue, which was called after him ``Bet Ya'akob,'' or ``Casa de Jacob,'' and was consecrated at the Jewish New Year's festival (September 1597). Annually on Yom Kippur a special prayer in his behalf is recited as an acknowledgment of his important services to the community. In his old age Tirado traveled to Jerusalem, where he died.
d2294	Grosvenor died at Earls Court in 1802 and was buried in the family vault at St Mary's Church, Eccleston. His assets amounted to ``under £70,000'' (£ as of ), but his debts were ``over £100,000'' (£ as of ). He was succeeded at Eaton Hall by his eldest son Robert.
d2295	Johnston McCulley died on November 23, 1958 in Los Angeles, California. The Los Angeles Times obituary gives an address in Los Angeles of 6533 Hollywood Blvd. at the time of his death, an address which is confirmed in the Marquis volume and places McCulley in the Hillview Hollywood Apartments. There is no record of when he moved there, although the Marquis article may have been originally prepared in the late 1940s/early 1950s, with additional material appended on in the late 1950s. The New York Times obituary mentions that he died ``after a series of operations'' a phrase echoed in other newspaper obits from other parts of the country, most likely taken from a New York Times feed.
d2296	Matters did not become easy for Fitzgibbon. In 1606, he was committed to gaol on suspicion of disloyalty, but was released upon his promise to do service against the rebels. King James I made him Baron of Clangibbon, but he died at Castletown on the 23rd of April 1608, without statutory confirmation of his lands and titles. It was the day after the death of his son Maurice, and they were buried together after lying a week in the church of Kilbeny in Kilmallock.
d2298	On August 15, 2010, Dillon died at his home in Rockville Centre after a long battle with lymphoma. He was 76 years old.
d2303	Charles Barton (1768-1843) was an English legal writer. He was called to the bar at the Inner Temple in 1795, and practised as a conveyancer. He died at Cheltenham on 18 November 1843, aged 75.
d2304	Panza died on 24 April 2010 in Milan.
d2305	In her autobiographical reminiscences Mathilde later wrote about Wagner's stay in Zürich, but made no mention of troubles with Minna. She died in Altmünster (Austria) in 1902, and she is buried at the Alten Friedhof with the Wesendonck family in Bonn, Germany.
d2306	He died in 1970 at Rhydcymerau, Carmarthenshire.
d2309	He was a member of the Tennessee House of Representatives in 1857, 1858, 1859, 1860, and 1861. He served in the Tennessee Senate in 1865. He was elected judge of the second judicial circuit of Tennessee in 1869. He was re-elected after the Tennessee state constitutional convention in 1870. He was elected as a Republican to the Forty-fifth Congress, serving from March 4, 1877 to March 3, 1879. He engaged in agricultural pursuits and milling. He died on August 22, 1900 in Newport, Tennessee in Cocke County. He was interred in Union Cemetery.
d2310	He was New York State Treasurer from February 5, 1808, to February 8, 1810, and again from February 18, 1812, to February 10, 1813. Afterwards he moved to Providence, R.I., where he died in 1831. He was buried at the Evergreen Cemetery in Salem, N.Y.
d2311	In Pansebeia, Ross gave a list of his books, past and to come. He died in 1654 at Bramshill House in Hampshire, where he was living with Sir Andrew Henley, and in the neighbouring Eversley church there are two tablets to his memory. Ross left many legacies, and his books were left to his friend Henley, an executor and guardian to a nephew, William Ross. Among Ross's friends and patrons were Lewis Watson, 1st Baron Rockingham, John Tufton, 2nd Earl of Thanet, Thomas Howard, 21st Earl of Arundel, and John Evelyn. His correspondence with Henry Oxenden, in English and Latin, is in the British Museum.
d2312	On December 11, 1973 Spoltore died of a heart attack at St. Francis Hospital in Trenton, New Jersey at the age of 52.
d2313	He unsuccessfully contested the election of Francis E. Shober to the 41st United States Congress, and afterwards resumed the practice of law until elected associate justice of the North Carolina Supreme Court in 1872. He served in that post until his death in Salisbury, on November 20, 1873; he is buried in the Lutheran Cemetery in Salisbury.
d2315	Shuford was elected as a Populist to the Fifty-fourth and Fifty-fifth Congresses (March 4, 1895-March 3, 1899). He was an unsuccessful candidate for renomination in 1898. He resumed agricultural pursuits near Newton, North Carolina. He served as presidential elector on the Progressive ticket in 1924. He retired from active business pursuits in 1928 and moved to Chapel Hill, North Carolina, where he died on February 8, 1933. He was interred in Chapel Hill Cemetery.
d2316	In 1827 Dighton was born to Isaac and Nancy Corson in Maine. He would live in Milwaukee, Wisconsin and Virginia City, Nevada before eventually moving to South Dakota. In 1915 he died in Pierre, South Dakota. Corson County, South Dakota is named for him.
d2317	He returned to England in 1847, and was appointed successively to the circuits of Islington, Bristol, Leeds, Penzance, Penryn, Truro and St Austell in east Cornwall. Shortly after his return to England he received the degree of Ph.D. from the University of Heidelberg. He was a patient, modest, hard-working and accurate scholar. He died at Camborne on 24 May 1866.
d2318	Juana died on July 23, 1888 at her son's home along Salado Creek in Bexar County, Texas. She was either buried there or at a Catholic cemetery within San Antonio.
d2319	Smith served in the lame-duck session, from December 2, 1884 to March 4, 1885. Afterwards, Smith resumed practicing law until his death in Des Moines on November 4, 1894. He was interned in Woodland Cemetery in Des Moines.
