d0	Toño Salazar died in 1986 in San Salvador from Parkinson's disease. A significant collection of his work is at the El Salvador Museum of Art in San Salvador who held a major exhibition of his works in 2005 and who named a reception hall in his honor.
d1	Garry continued to practice law after the Jonestown incident, his clientele changed and his chance for further national acclaim had passed. His post-Jonestown press conferences of November/December 1978 served as his final public acts. Garry died of a stroke in August 1991, at the age of 82 in Berkeley, California.
d2	His publications included the massive Volume 1 of the ``Treatise on Maine Ecology & Paleoecology'' (1957); and Introduction to Seashore Life of the San Francisco Bay Region (1962). His teaching posts included the Scripps Institution of Oceanography at University of California, San Diego. He was also director of the Pacific Marine Station, a University of the Pacific research facility at Dillon Beach, California, from 1957 to 1965. He was director of the Yaquina Biological Laboratories of the Marine Science Center, Oregon State University, Newport, Oregon, from 1965 to 1973. He retired as Professor of Oceanography in September, 1973. He and his wife moved to Santa Rosa, California during retirement. He died July 28, 2006 in Hillsboro, Oregon. His archives are housed at Scripps Institute of Oceanography in San Diego, California.
d3	She died in Lerwick on the 12th of March, 1827.
d4	In the 1840s Westmacott moved to Paris, where he died in 1868.
d5	Allfrey married Geraldine Clare Lucas-Scudamore in 1935, they had a son and a daughter. Allfrey died on 2 November 1964 in Bristol.
d6	Elizabeth Wells Cannon (December 7, 1859 -- September 2, 1942), also referred to as Annie Wells Cannon, was a prominent women's suffragist in Utah who served in the Utah House of Representatives from 1913 to 1915 and again in 1921. She was also president of the Daughters of Utah Pioneers and a charter member of the Utah Red Cross. Her father was Daniel H. Wells and she was married to John Q. Cannon. She died in Salt Lake City, Utah of Hodgkin's lymphoma.
d8	He lived in retirement in Naples where he died in 1903.
d9	Helen Ring Robinson (1878--1923), was either the first of the second woman to serve as a state senator in the United States and the first in the Colorado State Senate. She was elected in 1913. She died in Denver in 1923.
d11	Chan died at her home in Butterworth, Penang on May 26, 1987, leaving behind her husband, a son and three daughters -- her eldest son, from her first marriage, and an adopted daughter, having earlier disowned her. Her husband Low Kim Seng, son Chong Weng Thye, and daughter Irene were at her deathbed.
d13	Agnes Newton Keith died at age 80 in Oak Bay, British Columbia. Harry died the same year.
d14	On July 1, 1974, Perón died, leaving a divided party and his widow, who was earlier chosen Vice President as a compromise between feuding factions, in power. Increasingly strained by rising labor union wage demands and the 1973 oil shock alike, the Social Pact gradually lost its ability to contain inflation, and in November, Gelbard decided to resign. In March 1976 a bloody Military Junta overthrew Isabel Perón's presidency and in later years killed tens of thousands of people. Gelbard and his family left the country before the coup and obtained political asylum in the USA. All his assets in Argentina were quasi confiscated, frozen. There was a death sentence for him and his son Fernando. On October 4, 1977, Gelbard died of a heart attack in Washington DC. His son Fernando fought the Junta, recovered all the family assets, and in 1989 became Argentine Ambassador to France.
d15	After serving as Attorney General, Gilchrist returned to private practice in Jersey City. He married late in life to Fredericka Raymond Beardsley, who wrote The True Story of Hamlet and Ophelia (1889). Gilchrist died at his home in Jersey City in 1888.
d18	André Jean (or Andray), who was born in Paris, in 1662, became a Dominican in 1679. He went to Rome, where he received lessons from Carlo Maratti, and studied the works of Michelangelo and Raphael. He painted portraits and historical subjects, and has the character of being very correct in his designs, and a good colourist. He died at Paris in 1753. Amongst his best works may be mentioned the 'Feast of the Pharisee,' in the Dominican Church at Lyons; his own Portrait, in the Louvre; the'Marriage of Cana,' and the 'Miracle of the Loaves,' at Bordeaux; and the 'Adoration of the Kings,' and numerous others which he painted in various churches in Paris. Andre imparted instruction in art to Taraval, Chasle, and Dumont.
d19	Charley Thornton died on 16 February 2004 in Tuscaloosa, Alabama.
d20	He died at the Massachusetts General Hospital in Boston of heart failure. He had been in failing health since late January, when he underwent surgery for a recurrence of cancer. He was buried at Mt. Ararat Cemetery, Long Island, N.Y.
d22	Rick McNair (1942--2007), was a playwright, author, director, actor, storyteller, librettist, bibliophile, basketball player and coach. He was the former Director of Theatre Calgary and the Manitoba Theatre Centre and the founder of the Winnipeg Fringe Festival. Born in Amherst, Nova Scotia, he died in Winnipeg, Manitoba on January 31, 2007.
d23	He was born in County Cork, Ireland in 1817 and studied at Clongowes Wood College. Alleyn came to Lower Canada with his family around 1837. He was called to the bar in 1840. He supported the annexation movement in Quebec. He served on the city council for Quebec City from 1851 to 1857, serving as mayor in 1854. In 1854, he was elected to the Legislative Assembly of the Province of Canada for Quebec City. He supported the abolition of siegeurial tenure, an elected Legislative Council and separate schools. He served on the Executive Council as Commissioner of Public Works from 1857 to 1858 and secretary for Canada East from 1858 to 1862. In 1866, he resigned from politics to accept an appointment as sheriff for the district of Quebec; he served in this post until his death in Quebec City in 1890.
d24	Knox continued to work for the East India Company for thirteen years after his return from the East, captaining the ship Tonqueen Merchant for four further voyages to the East. He enjoyed only mixed success and quarrelled with the company, which eventually dismissed him in 1694. Four years later he set himself up on his own trading vessel, the Mary, but the venture was not a success. He returned permanently to England in 1701 and spent his retirement writing about Ceylon and his life. He died, properous but unmarried, at St Peter le Poer in the City of London in June 1720 and was buried at St Mary's Church, Wimbledon.
d25	He died 30 January 1683 in Rome
d26	Harry H. Johnson died on 6 Aug 1987 in Kerrville, Texas. He was buried on 11 Aug 1987 in Fort Sam Houston National Cemetery, San Antonio, Texas.
d27	Early in 197 BC, Flamininus, summoned Attalus to join him at Elateia (now in Roman hands) and from there they traveled together to attend a Boeotian council in Thebes to discuss which side Boeotia would take in the war. At the council Attalus spoke first, reminding the Boeotians of the many things he and his ancestors had done for them, but during his address he stopped talking and collapsed, with one side of his body paralyzed. Attalus was taken back to Pergamon, where he died around the time of the Battle of Cynoscephalae, which brought about the end of the Second Macedonian War.
d29	The Thayer School admitted its first three students to a graduate program in 1871. Also in 1871 at the bequest of his will Thayer Academy in Braintree, Massachusetts was conceived. It opened September 12, 1877. Sylvanus Thayer died on September 7, 1872 at his home in Braintree. He was reinterred at West Point Cemetery in 1877.
d30	After leaving Congress, Horace G. Snover moved to Port Huron, where he died at the age of seventy-six and is interred there in Lakeside Cemetery.
d31	In addition, he wrote numerous letters to the Society for the Propagation of the Faith describing his missionary activities. These letters were widely published at the time, and were instrumental in inspiring both Saint John Neumann and Father Francis Xavier Pierz to come to the United States. In time, Baraga became renowned throughout Europe for his work. In his last ten years, his health gradually declined; he became intermittently deaf and suffered a series of strokes. He died January 19, 1868 in Marquette, Michigan. He is buried there in the crypt beneath the Cathedral of Saint Peter.
d32	She was born in Chicago, Illinois, graduated from the Visitation Academy of Georgetown, D.C., in 1879, and afterward devoted herself to literary work. She died in Arequipa, Peru.
d33	Beyer battled with Amyotrophic lateral sclerosis (ALS), also known as Lou Gehrig's disease, during the final years of her life. She died in New York, New York, in 1944.
d34	Morley began to make recordings with the banjo player Olly Oakley for Pathé Records.Out of all records he made, he only made one solo record on Homochord label: Jovial Huntsman and Donkey Laugh. In August 1932, he made his radio debut as a banjo soloist. Five months later, he went on the air with the Kentucky Minstrels. Morley who never married, died at the Lambeth Hospital in London.
d35	Carayon died at Poitiers in 1874.
d36	Hal Draper died of pneumonia in 1990 at his home in Berkeley, California.
d37	Nathan Webb, an early American Congregational Church minister, was born on April 9, 1705, at Braintree, Norfolk County, Massachusetts. He died on March 17, 1772 at Uxbridge, Worcester County, Massachusetts
d38	Clive Hulme died at Te Puke on 2 September 1982, and was buried in the civilian section of the Dudley-Vercoe Cemetery in the town.
d39	He died on 24 October 1967 in St Andrews.
d40	Milo White (August 17, 1830 -- May 18, 1913) was a Representative from Minnesota; born in Fletcher, Franklin County, Vermont; attended the common schools and Bakersfield Academy; moved to Chatfield, Fillmore County, Minnesota in 1855 and engaged in mercantile pursuits; chairman of the board of supervisors of Chatfield upon its organization in 1858; served in the State senate 1872 -- 1876, 1881, and 1882; elected as a Republican to the Forty-eighth and Forty-ninth congresses (March 4, 1883 -- March 3, 1887); unsuccessful candidate for election in 1898 to the Fifty-sixth congress; resumed mercantile pursuits; mayor of Chatfield for several terms; member of the school board until his death in Chatfield, Minnesota; interment in Chatfield Cemetery.
d41	Maija Grotell (August 19, 1899 -- December 6, 1973) was a ceramist and teacher sometimes described today as the ``mother of American ceramics''. Grotell was born in Helsinki, Finland, and emigrated to New York in 1927. After arriving in New York she studied at the New York State College of Ceramics at Alfred University. From 1927 until 1938 she taught at various positions in New York City, ultimately departing the city to take a position as head of the ceramics department at the Cranbrook Academy of Art in Bloomfield Hills, Michigan, where one of her colleagues was the architect Eliel Saarinen. Grotell retired from Cranbrook in 1966. She died on December 6, 1973, in Pontiac, Michigan.
d42	Victor Ganz died of lung cancer at his home in New York on October 26, 1987. He was 74 years old. Sally Ganz died January 27, 1997, also at home, aged 85.
d43	Andreas Dippel died of heart disease at the age of 65 in Hollywood, California on 12 May 1932.
d44	He died on August 17, 1954 in Washington, D.C., two weeks after being re-nominated in the Republican primary election to the 84th Congress. He was interred in Memorial Park Cemetery, Battle Creek, Michigan.
d45	King died of a heart attack in 1963 at her home in Hollywood and is buried at Forest Lawn in Glendale, California.
d46	He received a recess appointment from President Abraham Lincoln on March 18, 1863, to a new seat on the United States District Court for the District of Columbia (then called the Supreme Court of the District of Columbia) created by 12 Stat. 762. He was formally nominated to the seat on January 5, 1864, and on January 20, 1864 he was confirmed by the United States Senate and received his commission. He retired from the bench on May 1, 1885, and resumed private practice until his death in Washington, D.C. in 1905, at the age of 91.
d47	He died on 23 March 1888 at Kensington, having never married.
d48	He died on October 29, 2011 at his home in Berlin, Germany, and is survived by his wife, Kirsten. His other descendants were two daughters from his previous marriage to Mandy, Dinah and Delia (deceased), and two granddaughters, Emily and Holly.
d49	During his literary career, Dygasiński wrote several short stories and novels. Since 1884 his works were being published in book-form and enjoyed considerable success. They were translated into Russian and German. In 1891 Dygasiński went on a trip to Brazil on a trail of Polish emigrants from Partitioned Poland. He produced a series of letters describing the tragic fate of Polish emigrees in South America. In the following years Dygasiński maintained a position of a tutor and coach for numerous wealthy landowning families. Late in life he settled in Warsaw, where he died on June 6, 1902, and was buried at the local Powązkowski Cemetery.
d50	In 1618, Abdullah Ma'ayat Shah moved to Lingga and gained the support of Orang Laut and the Dutch to wage a war against Aceh. He later divorced his wife who was also a sister of Iskandar Muda, a move that further angered the sultan. He spent most of his reign as a wanderer, pursued from town to town and island to island by the Acehnese. He died at Tambelan archipelago on March 1623.
d51	John Courtney Murray was born in New York City in 1904 and entered the New York province of the Society of Jesus in 1920. He studied Classics and Philosophy at Boston College, receiving bachelor's and master's degrees in 1926 and 1927 respectively. Following his graduation, he travelled to the Philippines where he taught Latin and English literature at the Ateneo de Manila. He returned to the United States in 1930 and was ordained a Roman Catholic priest in 1933. He pursued further studies at the Gregorian University in Rome and completed a doctorate in sacred theology in 1937. Returning to the United States, he taught Catholic trinitarian theology at the Jesuit theologate at Woodstock, Maryland and, in 1941, was named editor of the Jesuit journal Theological Studies. He held both positions until his death in Queens, New York in 1967. He died of a heart attack.
d52	Figliucci attended the Council of Trent, where he delivered a Latin oration. He died at Florence.
d53	Hickey wrote about ten books dealing with religious matters after converting to Catholicism in 1901. One of her better-known poems is Beloved, It Is Morn. She died in London.
d54	Fawcett's son Samuel was ordained at Beaminster, Dorset in 1777; he became a Unitarian, and retired from the ministry, living on his private estate near Bridport. From 1801 to 1816 he was Unitarian minister at Yeovil, where he died on 14 December 1835, aged 81.
d56	Swartz was elected as a Republican to the Sixty-ninth Congress. He declined to become a candidate for reelection in 1926, and resumed the practice of law until his death in Harrisburg. He is buried in Paxtang Cemetery in near Harrisburg.
d58	In 1841 he was appointed minister of the Birmingham Synagogue and master of the school. He continued in these capacities for eight years, and then sailed for New York (1849). In that city he was appointed rabbi and preacher of the B'nei Jeshurun congregation, where he continued as pastor till 1866, his duties then being relaxed owing to his infirm health. He died at New York on June 23, 1868.
d59	He died at Aschaffenburg in 1545. -
d61	Darby was elected as a Democratic-Republican to the Ninth and Tenth Congresses and served from March 4, 1805, until his death in Washington, D.C., January 27, 1808. He was interred in Congressional Cemetery in Washington, D.C.
d62	He was elected as a Republican to the Eightieth and Eighty-first Congresses. He served from January 3, 1947 to January 3, 1951, but he was not a successful candidate for renomination in 1950. Dayton Phillips then resumed the practice of law. From 1952 until his death, he was the chancellor of the First Chancery Court of Tennessee. He died on October 23, 1980 in Kingsport, Tennessee. He had resided in Elizabethton, Tennessee. He was interred in Happy Valley Memorial Park.
d63	Dillard died at his home in Little Rock.
d66	Sharp died at Chiswick on the 25th of July 1824, and was buried in the parish churchyard there.
d68	He died December 7, 2008 in Chappaqua, New York.
d70	Blair was elected a member of the legislative assembly of Victoria in 1856 and again in 1868, but did not make any special mark in politics. In 1876 he edited the Speeches of Henry Parkes, and in 1879 he published The History of Australasia--to the Establishment of Self-Government, based largely on the works of his predecessors. He died at Melbourne on 19 February 1899, aged 78.
d71	James L. English died at age 76 in Sacramento. He is interred in the Sacramento Historic City Cemetery.
d72	He was married to Elizabeth Hubert and they had three sons. He died at Ile Bonaventure.
d74	Born in Galashiels, Stirling was the son of stonemason James Stirling. After training as an architect in his native country, he immigrated to St. John's, Newfoundland in 1847 where he played a major role in rebuilding portions of the town destroyed by fire the year previously. He spent the next 35 years designing and building a wide array of buildings out of practices in Charlottetown, Halifax, and Toronto. Having never retired, he died in Charlottetown in 1887 at the age of 64.
d79	Broughton was born in London on 5 July 1704, was the son of the rector of St. Andrew's, Holborn. He was educated at Eton, and, being superannuated on that foundation, went about 1772 to Cambridge, where 'for the sake of a scholarship he entered himself of Gonville and Caius College. ' In 1727, after taking B.A., he was admitted to deacon's orders, and in 1728 he was ordained priest, and proceeded to the M.A.. He served for several years as curate of Offley, Hertfordshire, and in 1739 became rector of Stepington, Huntingdonshire; the patron, the Duke of Bedford, also appointing him one of his chaplains. As reader to the Temple, to which he was chosen soon afterwards, he won the favour of the master, Bishop Sherlock, who in 1744 presented him to the vicarage of Bedminster, near Bristol, with the chapels of St. Mary Redcliffe, St. Thomas, and Abbot's Leigh annexed. To the same influence he owed a prebend in Salisbury Cathedral, and on receiving this he removed from London to Bristol, where he died on 21 Dec. 1774. He was an industrious writer in many kinds of composition. He published (1742) an Historical Dictionary of all Religions from the Creation of the World to the Present Times, a huge work in two volumes folio ; he translated Voltaire's 'Temple of Taste,' and part of Pierre Bayle's Dictionary; vindicated orthodox Christianity against Matthew Tindal ; converted a Roman catholic book ('Dorrel on the Epistles and Gospels') to protestant uses; edited John Dryden; wrote in defence of the immortality of the soul; and contributed the lives marked 'T' in the original edition of the 'Biographia Britannica. ' John Hawkins, in his Life of Johnson, credits Broughton with being the real translator of Jarvis's Don Quixote. 'The fact is that Jarvis laboured at it many years, but could make but little progress, for being a painter by profession, he had not been accustomed to write, and had no style. Mr. Tonson, the bookseller, seeing this, suggested the thought of employing Mr. Broughton ... who sat himself down to study the Spanish language, and in a few months acquired, as was pretended, sufficient knowledge thereof to give to the world a translation of ``Don Quixote'' in the true spirit of the original, and to which is prefixed the name of Jarvis. ' Broughton was a lover of music, and acquainted with Handel, whom he furnished with words for some of his compositions, including the drama of 'Hercules,' first given at the Haymarket in 1745. In private life he was of a mild and amiable disposition, but in controversy, though not discourteous according to the standard of his time, he was very economical in his concessions to his opponents, and he has been characterised in some respects as a weak and credulous writer.
d80	He died at his home in New York City on February 13, 1926 and was buried in Greenwood Cemetery.
d81	He died alone, of bronchial pneumonia, at the Chelsea Hotel in New York.
d83	Linda Dangcil died at Cedars-Sinai Medical Center in Los Angeles on May 7, 2009, following an eight-year battle with throat cancer at the age of 67. She was survived by her husband, jazz musician Dick Hamilton, and their children, Linda Michele and Sky Hamilton, as well as a granddaughter and a brother,
d84	Precisely six years after Armistice Day, at age 32, Madon was killed in his native Tunisia preparing for a tribute to fellow airman Roland Garros. His aircraft suffered mechanical trouble, and he gallantly crashed it into the roof of a villa rather than hit spectators. He died in Tunis.
d85	Canisius was a half-brother of St. Peter Canisius. After winning, at the age of twenty-two, the highest academic distinction at Louvain, he decided to follow his stepbrother and enter the Society of Jesus, and was sent to St. Ignatius of Loyola in Rome, who received him into the Society. On the completion of his novitiate, Theodorich was appointed professor of theology in Vienna, but was soon after appointed rector of the Jesuit College at Munich. Here, in 1562, one of the first productions in Germany of the morality play Homulus (corresponding to the English Everyman or the Dutch Elckerlijc) was given in Latin by the students under his direction. From Munich, where he was succeeded in 1565 by the celebrated Paul Hoffaeus, he was transferred to Dillingen, where for twenty years he presided over the college and the academy and laboured with zeal and success for the improvement of studies and for the religious training of the students. From 1565 to 1582 he held the office of chancellor of the university. In company with his distinguished brother, he attended the first provincial congregation of the Society of Jesus in Upper Germany, and furthered important reforms in the teaching of philosophy. In 1585 he was made rector of the college of Ingolstadt, and in this capacity became a member of the German commission which tested in practice the first draft of the Ratio Studiorum. At length, having spent thirty years at the head of three of the foremost colleges of Germany, he was sent to Lucerne in Switzerland to enjoy a period of rest; but soon again, at the age of sixty-three, he had to undertake the government of the college of Ingolstadt. Two years later, on the advice of his physician, he was relieved of the burden and allowed to return to Lucerne. A fortnight after his arrival the death of St. Peter Canisius was announced; the shock deprived Theodorich of memory and speech, an affliction which he bore with exemplary patience for seven years. For his amiable disposition and spotless purity of life he deservedly received the surname of Angelus 'angel'. In 1604, he was transferred again to Ingolstadt, where he died, and was interred in the church of the Holy Cross.
d86	He died at Padua in 1768 before the completion of the great work on which he had long co-operated with Facciolati. This was the vast Latin Lexicon, which has formed the basis of all similar works that have since been published. He was engaged with his Herculean task for nearly thirty-five years, and the transcription of the manuscript by Luigi Violato occupied eight years more.
d87	Tanaka died at age 93 on May 21, 2009, at the Ronald Reagan UCLA Medical Center in Los Angeles. He was survived by his wife, to whom he had been married for 68 years, as well as three children, five grandchildren and eight great-grandchildren.
d88	Gordon was the son of George Gordon, 3rd Earl of Aberdeen and his mistress Penelope Dearing. His commission was purchased for him in 1803. After service in the Peninsular War he sold his commission in 1811 on his marriage to Albinia Elizabeth Cumberland. He was acknowledged by the 3rd Earl as being his son and was provided for in the Earl's will. He died at Ellon in Aberdeenshire on 21 March 1873.
d89	John Nathan Cobb suffered from heart disease and endured a heart attack in the summer of 1929. He was ill for many months and spent his final days in the warmer climate of La Jolla, California, where he died on 13 January 1930 at the age of 61. His death was prominently noted in local newspapers and in numerous fisheries publications.1,2,29
d90	On February 8, 1931, Ben E. Cabell died at Fort Sam Houston, Bexar County, Texas. He was interred at Greenwood Cemetery, Dallas, Texas.
d91	George Maddox died on 7 July 1867 in Melbourne, Victoria at the age of 56.
