d695	Zhefarovich made a pilgrimage to Jerusalem through Thessaloniki and Jaffa and later established himself in the Epiphany Monastery in Moscow, where he died on 18 September 1753. Zhefrovich was the author of two religious works, an instruction to newly-appointed priests (Поучение святителское к новопоставленному йерею, Pouchenie svyatitelskoe k novopostavlennomu yereyu) from 1742 and a description of Jerusalem from 1748 (Описание светаго божия града Йерусалима, Opisanie svetago bozhiya grada Yerusalima). His name is also associated with two textbooks -- a primer and a grammar book, as well as numerous copper gravures of renowned personalities from Vojvodina.
d696	Townsend ran a drugstore in Payson, Utah for 15 years. He then taught for two years at Brigham Young Academy, the predecessor of Brigham Young University. After this he taught at Salt Lake City High School. He died at Payson, Utah.
d698	Allen was elected as a Democrat to the Thirty-sixth and Thirty-seventh Congresses (March 4, 1859--March 3, 1863), where he served as chairman, Committee on Expenditures in the Department of the Interior (Thirty-seventh Congress). He declined to be a candidate for renomination in 1862 and resumed the practice of law. He became affiliated with the Republican Party at the close of the Civil War and was appointed judge of the Court of Common Pleas of the second judicial district in 1865. He declined the Republican nomination for election to the Forty-sixth Congress in 1878 because of failing health. He was interested in banking until his death in Greenville, Ohio in 1881. He was buried in Greenville Cemetery. Allen County, Kansas, is named after him.
d699	The following year he married Louise St. Leger Vance, his secretary at Fox Studios. They had two children, Laurence, Jr. (born 1939) and Sally (born 1941). Stallings died of a heart attack in Pacific Palisades, California. He was buried with full military honors at Fort Rosecrans National Cemetery in Point Loma near San Diego.
d701	Norris died at Santa Bárbara d'Oeste on July 13, 1893.
d702	He died April 10, 1981 in San Francisco, California.
d703	He died at Society Hill, South Carolina, on August 30, 1867, and was interred in the Episcopal Cemetery in Society Hill, South Carolina.
d706	She died suddenly while in London, England after addressing the International Women's congress on June 28, 1899. Ellen Johnson left money to the city of Boston, to make Westland Gate, a fountain in memory of her husband, Jesse Johnson.
d707	François died at Bayonne on the 19 or 20 September 1585.
d708	Frans de Momper, a Flemish landscape painter, who was a native of Antwerp, is inscribed in the ' Liggere' of the Guild of St. Luke in that city in 1629-30. He died at Antwerp in 1660-61. There are by him in the Augsburg Gallery, 'St. Philip baptizing the Eunuch,' and a 'Rocky Scene,' in which the figures are by F. Francken and the animals by J. Brueghel.
d709	Yates was elected a member of the State assembly in 1836 and served until his death in Chittenango, New York, July 10, 1836. He was interred in Walnut Grove Cemetery, near Chittenango, New York.
d710	Milton Meltzer died at his home in New York City from esophageal cancer on September 19, 2009, aged 94.
d711	Following the American-led invasion of Iraq, Horan worked for six months as a senior counselor on tribal and religious issues for the Coalition Provisional Authority in 2003. During this time he traveled across Iraq with little security, and was to meet Grand Ayatollah Ali al-Sistani before a protest in Najaf by Muqtada al-Sadr prevented it. He was referred to by CPA head L. Paul Bremer as his ``pet Bedouin,'' and was rewarded for his work with the Distinguished Public Service Award by the Department of Defense. He died at Inova Fairfax Hospital in 2004 after battling prostate cancer.
d712	Smith was elected as a Republican to the Sixty-second and to the four succeeding Congresses, serving from March 4, 1911 until March 3, 1921. He was chairman of the United States House Committee on Labor in the Sixty-sixth Congress. Smith was not a candidate for renomination in 1920, but returned to Congress when he was elected to the Sixty-seventh Congress to fill the vacancy caused by the death of William H. Frankhauser, who died in office on May 9, 1921. Smith was reelected to the Sixty-eighth Congress, serving from June 28, 1921, until his death in Charlotte. He is interred in Maple Hill Cemetery in Charlotte.
d713	After a winter of bronchitis, Burnand died in 1917 at his home in Ramsgate, Kent, at the age of 80. He was buried in the cemetery at St Augustine's Abbey church in Ramsgate.
d716	Prall was born near Ringoes, New Jersey. He attended Harvard University (1906) and New York University School of Law (LL.B. 1908). After almost two decades of practicing law, Prall was elected to the legislature, first to the Assembly (1927--28), then to the State Senate (1928--36), serving as president of that body in his last two years of tenure. After the resignation of Governor A. Harry Moore, Prall served as Acting Governor for a brief period (January 3, 1935 - January 15, 1935). After completing his last term as a Senator, Prall became a judge on the Court of Common Pleas. He died April 23, 1951 in Trenton, New Jersey.
d718	Nagle died on July 24, 2007 in Stoughton, Massachusetts.
d719	Brennan died of lymphatic cancer in 1996 at his daughter's home in Massapequa, New York. He was interred in Saint Charles Cemetery in Farmingdale, Long Island, New York.
d720	Prager was promoted to Major on 19 June 1940 and on 1 July took command of the 3rd Parachute Regiment's II Battalion. He died on 3 December 1940 in Braunschweig, of cancer.
d722	He was Deputy Secretary of State under Frederick Cook, retiring at the end of 1889, and there was talk of nominating Willers for Secretary of State again, but he declined due to declining health. He died at Varick on June 25, 1908.
d723	From 1878 to 1884, he was the attorney general of the fifth judicial circuit. He was elected as a Democrat to the 52nd and 53rd Congresses. He served from March 4, 1891 to March 3, 1895, but he was not a successful candidate for re-election to the 54th Congress. He was a delegate to the Democratic National Convention in 1896. He resumed the practice of his profession in Sparta, Tennessee in White County. He moved to Gould, Oklahoma and engaged in agricultural pursuits. He died on April 22, 1931 in Altus, Oklahoma. He was interred in Altus Cemetery. He was the uncle of fellow Tennessee congressman Charles Edward Snodgrass.
d724	In 1835, James Dakin followed his brother and Gallier to New Orleans. Ambitious, he realized, as Gallier had, the opportunities New Orleans offered. For a time there seems to have been a loose partnership between the three. One example of their collaboration is Barton Academy in Mobile, Alabama, started in 1835. Both James Dakin and Gallier claim to have been the architects of certain New Orleans buildings of the period. Within a year, however, the Dakins left Gallier and practised for a time together as Dakin & Dakin and as Dakin, Bell & Dakin; later still they split. Charles began an ill-fated branch office in Mobile, Alabama, where he supervised the construction of the Government Street Presbyterian Church, completed in 1836. The collapse of a row of warehouses he designed affected him so deeply that it is thought to have been a cause contributing to his early death in St. Gabriel, Louisiana. He had gone to Texas to begin anew. That year (1839) the Great Fire of Mobile also destroyed much of the firm's incomplete work there.
d726	He died at Dedham, Massachusetts on the 13th of February, 1863 and is buried in the Dedham Village Cemetery. Perhaps the greatest recognition of his skill as a landscape artist came one hundred years later when First Lady Jacqueline Kennedy chose his painting,The Remnant of the Tribe, to hang in the Green Room of the White House. The Dedham Historical Society has a collection of his paintings, sketches and biographical material. His largest oil painting, Washington at Dorchester Heights, a nine-by-six foot copy of Gilbert Stuart's painting of the same title, hangs in the Dedham Town Hall, a testimonial to the town's most illustrious painter.
d727	In 1809, Ueda died at the age of 76 in Kyoto.
d728	He died September 4, 1856 in Edinburgh, Scotland and is buried in Warriston Cemetery in Edinburgh.
d729	He died on 15 September 1974 in London, England. He was at the first floor at the Prembridge Court Hotel, in room eight when he suffered from a brain stroke.
d730	Stigand (died 1072) was an English churchman in pre-Norman Conquest England. Although his birthdate is unknown, by 1020, he was serving as a royal chaplain and advisor. He was named Bishop of Elmham in 1043, and then later Bishop of Winchester and Archbishop of Canterbury. Stigand acted as an advisor to several members of the Anglo-Saxon and Norman English royal dynasties, serving six successive kings. Excommunicated by several popes for his pluralism in holding the two sees, or bishoprics, of Winchester and Canterbury concurrently, he was finally deposed in 1070, and his estates and personal wealth were confiscated by William the Conqueror. Stigand was imprisoned at Winchester, where he died without regaining his liberty.
d731	However, Władysław's promising career had a suddenly and unexpected end. The prince is last mencioned in a document dated on 15 May 1355, and soon after he died in Pisa. The circumstances about the death of the Cieszyn prince were further narrated by the Italian chronicler Matteo Villenis: according to him, the Polish prince Stefan (obviously the name is erroneous, but from the context, it's clear that only could be Władysław) went with part of the Bohemian retinue to Florence, where Władysław was covered with high honors from the Emperor. After the banquet given in his honor, the prince fell heavily sick and soon after his return to Pisa he died. The death of his young favorite affected deeply to Charles IV, so that he decided to leave Italy immediately, especially from Pisa. This action caused the eruption of a violent anti-imperial riot, who was bloody clashed.
d732	On November 23, 1885, Tường was deported to Tahiti in the Pacific Ocean where he died in February 1886. In July, his body was returned to his family in Huế.
d733	Charlotte von Rothschild died at her Gunnersbury Park home in 1884 and was buried next to her husband in the Willesden Jewish Cemetery. Following her death, her eldest son named a newly constructed block of housing for low-income persons ``Charlotte's Buildings.''
d734	Vullum died in March 1916 in Lillehammer.
d736	Wagner was elected as a Whig to the Twenty-sixth Congress (March 4, 1839-March 3, 1841). He served as chairman of the Committee on Expenditures in the Department of War (Twenty-sixth Congress). He continued the practice of law at Fort Plain until May 1873, when he retired. He died at Fort Plain, New York, September 13, 1884. He was interred in Fort Plain Cemetery.
d737	Gibson left the Department of Lands for a time, but joined it again in January 1882, and on 1 May 1883 was appointed a relieving crown land agent. He became inspector of crown land agents' offices on 20 August 1896, and in his official capacity travelled widely throughout New South Wales. He retired from the department on 30 June 1915 and lived at Lindfield until he died in Lindfield, Sydney, at the age of 74.
d738	After a long battle with cancer, Drake Levin died July 4, 2009 at his home in San Francisco, with his wife Sandra at his side.
d739	White's career was tragically struck short in 1943 when she developed a severe case of rheumatoid arthritis that forced her to retire. She battled the disease for the rest of the life. She died in 1984 in Los Angeles County, California.
d740	Following the death of John William Finn on May 27, 2010, Hajiro became the oldest living Medal of Honor recipient. Hajiro died January 21, 2011 in Waipahu, Hawaii.
d741	He was born Arthur-Henri-René Turcotte in Montreal in 1845, the son of Joseph-Édouard Turcotte. He studied at the Jesuit Collège Sainte-Marie de Montréal and at Stonyhurst College in England. He then studied law at the Université Laval and McGill and was called to the bar in 1867. He began practice in Trois-Rivières. In 1872, he served as parliamentary correspondent in the provincial assembly for Le Canadien. In 1873, he became a member of the town council in Trois-Rivières and served as mayor from July 1876 to July 1877. Turcotte was elected to the Legislative Assembly of Quebec for Trois-Rivières in a 1876 by-election as an independent Conservative; he was reelected in 1878. Turcotte served as speaker of the assembly from 1878 to 1882. He was named Queen's Counsel in 1878. In 1879, he helped found La Concorde, becoming its editor. He was defeated in 1881, now running as a Liberal but, after his opponent was unseated because he was accused of bribery, won the seat in an 1884 by-election; he was reelected in 1886. Turcotte condemned the actions of the federal government during the Northwest Rebellion, was part of the campaign in Quebec to save Louis Riel and supported autonomy for the Métis people. In 1884, after La Concorde ceased publication, he helped establish a new newspaper, La Sentinelle. In 1887, he was named minister without portfolio in the cabinet of Honoré Mercier and served as attorney general from 1888 to 1890. He was defeated in the 1890 election. Later that year, Turcotte was appointed protonotary for the Superior Court in Montreal district and served until his death in Montreal in 1905. He was buried in Trois-Rivières.
d742	After attending Dummer Charity School (now The Governor's Academy), Sewall graduated from Harvard College (AB 1776, AM 1779, honorary LLD 1808 and set up practice as a lawyer in Marblehead. He served as a member of the state legislature in 1783 and from 1788 to 1796. He represented Massachusetts in the U.S. House from 1796 to 1800, and from 1800 to 1814 served as a judge of the Massachusetts Supreme Judicial Court, serving as Chief Justice in 1814. He died at Wiscasset, Massachusetts (now Maine) while holding a court there.
d743	Krasny died at the age of 112 in Moscow and was buried at the New Donskoy Cemetery there. His supercentenarian age was never independently confirmed. His final publication was a memoir about Sergei Yesenin.
d745	Sandford died at Market Drayton, Shropshire at the age of 80.
d746	She had always worked with her father at the Windmill Theatre, which she inherited on his death in 1960, but the changing nature of Soho in London meant that it closed in 1964. In 1965 Sheila van Damm toured the Tivoli Circuit Theatres in Sydney and Melbourne, Australia, with her show, `` The Windmill Revue'' . The show featured a number of former Windmill Theatre artistes. This in turn lead her to retire with her sister to their small farm in Pulborough in Sussex. She died in London on 23 August 1987.
d747	He died in 1982 in Whittier, California after a series of strokes. On June 7, 2005, Lund municipality raised a monolith in a park in Moi to his memory, listed him as Norway's most famous boxer.
d749	Alger's extensive writing on ordnance included two books, Exterior Ballistics (1904) and The Elastic Strength of Guns (1906), which came to be regarded as standards in their fields. His work entitled Hydromechanics (1902) was used as a textbook at the Naval Academy and other institutions of higher learning. Alger also penned numerous articles on a wide range of technical subjects. Alger died at Annapolis, Maryland, on February 23, 1912.
d750	She married to William Wilson Athens II, 23 December 1917, as his second wife. She died in Cincinnati, Ohio.
d751	In 1705 he followed Amelot de Gournay to Spain but illness forced him to return to Paris, where he died in 1709.
d753	He was married to Hanna Gjerde (1890--1929) from August 1916. After her death he married Ingeborg Landmark Anthonisen (1905--1955) in July 1933. After her death he married for the third time, in 1964, this time to Astrid Kolderup, née Christie (1907--2000). Thomas Scheen Falck died in November 1972 in Bergen. His son, Hans L. Falck (born 1921), was a board member of Bergenske Dampskibsselskab from 1961 to 1967. He was decorated as a Commander of the Order of St. Olav (1951), Order of the Dannebrog, Order of the Crown of Italy and the Order of Ouissam Alaouite; Commander First Class of the Order of Vasa; Grand Officer of the Order of Leopold II and Order of Orange-Nassau; and Officer of the Legion of Honour.
d754	John Sinclair died at Kangaroo Point, Brisbane on 5 May 1906 aged 79 years and was buried in Toowong Cemetery, together with his second wife Constance and his two of his adult children Margaret and James.
d755	He was elected as a Democratic-Republican to the Sixteenth Congress (March 4, 1819-March 3, 1821). He did not seek renomination in 1820. He was appointed register of the land office at Little Rock, Arkansas in 1821, and settled in that state. He was secretary to the governor of Arkansas 1825-1828; appointed by Governor George Izard as subagent of the Quapaw Indians in 1825, and served until his death in Little Rock on July 16, 1835. He is intered in Mount Holly Cemetery.
d756	He was assistant successively to the collector of Bareilli, the political agent at Delhi, and the collector of the southern division of Muradabad; secretary to the Sudder board of revenue for the North-Western Provinces; and (1847) secretary to the governor-general in council for the foreign department. In this capacity he accompanied Lord Hardinge to the Panjab and drew up an admirable memoir on its resources. As foreign secretary he also visited the western frontier with Lord Dalhousie, on the occasion of the Sikh War, and negotiated the treaty with the Sikh chiefs relative to the settlement of the Panjab and Gujarat, and received the K.C.B. for his services (1849). Throughout his official career he had devoted his leisure to study. At a very early period he conducted a magazine at Mirat which contained many valuable articles on Indian subjects. With a view to assisting the projected official 'Glossary of Indian Judicial and Revenue Terms,' he published in 1845 at Agra his 'Supplement to the Glossary,' which is rightly described by Professor H. H. Wilson as 'replete with curious and valuable information, especially as regards the tribes and clans of Brahmans and Rajputs. ' A second edition appeared in 1860. His chief work, however, was the 'Bibliographical Index to the Historians of Mohammadan India,' in which he proposed to give an analysis of the contents and a criticism of the value of 231 Arabic and Persian historians of India, but of which he only lived to publish the first volume (Calcutta and London, 1849). Failing health compelled him to seek a change of climate, and he died on his way home at Simon's Town, Cape of Good Hope, 20 Dec 1853, aged 45. He married the daughter of W. Cowell, formerly judge at Bareilli.
d757	Archibald Stevenson died at his home in New Canaan, Connecticut, on February 10, 1961. He was 77 years old at the time of his death.
d759	Whitehead intended to return to the Philippines in 1899, but was he was forced to alter his plans by the Spanish-American War. He instead travelled to the island of Hainan, where he died of fever.
d760	The quietness of a literary life was rudely broken by the French Revolution, to which he was openly hostile. His leanings to the unpopular side were so obnoxious to his fellow-citizens that he was obliged to quit his native country in 1792, and remained in exile till 1801. He died at Geneva.
d761	He was born on the Isle of Wight, England. He enlisted in the Royal Navy in London in 1795, and served on HMS Caroline during the wars with France, then was invalided home from Minorca in 1800. The National Maritime Museum in London has 27 watercolours by him, several of which are mounted on sheets from 18th century printed signal and muster books. He went on to paint numerous naval battle scenes and pictures such as the '''Inshore Squadron off Cadiz in 1797'`` which are thought to show scenes he witnessed. On being appointed Marine Painter to the East India Company he painted ship portraits on commission. It had been thought that he died in 1830, but recent research has found that he painted Queen Victoria's visit to Edinburgh in 1842 before he died in London later that year.
d762	Vittorio Torre died 16 January 1921 in Turin (Italy) was an Italian chess player.
d763	The location however didn't suit Swami Swarupananda well, as the constant uphill and downhill of Mayavati terrain, took a toll on his heart, and in November 1901 he was in Calcutta with Swami Vivekananda recuperating ; however he continued to edit the magazine and run the Ashram for another six year, when in 1906, he died in Nainital.
d764	He died at Rome in January 1718. He was the adoptive father of Metastasio.
d765	Sampson was the son of a journalist. At the age of twelve he entered a printing office in London, and became successively a compositor and proof-reader. From youth he was devoted to sport, and excelled as a boxer, runner, and sculler until he was twenty-three, when he was disabled by an accident to his left foot.
d766	Emlen Etting died of Parkinson's disease on July 20, 1993, at his home in Philadelphia at the age of 88.
d767	He was born in Helmsley, Yorkshire, England in 1807 and came to Niagara in Upper Canada in 1835 where he entered business as a bookseller. With George Menzies as a partner, he began publishing the Niagara Chronicle in 1837. He also published some other works, including The Canadian mercantile almanack, and became sole owner of the newspaper in 1839. He took on other business interests and also served as customs collector at Niagara. Simpson served on the council for Niagara District and the town council for Niagara, serving as mayor from 1852 to 1855. In 1857, he was elected to the Legislative Council for Niagara; he was reelected in 1861 and 1863. In March 1864, he was named to the Executive Council as provincial secretary. Later that year, he resigned his seat, allowing Angus Morrison to enter the cabinet. He was appointed deputy auditor general and served in that post until his death in Ottawa in 1878.
d768	He died of fever at Lisburn 22 May 1695, and was buried there. The bishop was married, and left issue.
d769	Giovanni Alberti, brother of Cherubino Alberti, and third son of Alberto, was born at Borgo S. Sepolcro, in 1558. He visited Rome in the time of Gregory XIII, and was employed by that pontiff in the papal palace on Monte Cavallo, and in the Vatican. He excelled in painting landscapes and perspective, in which the figures were usually painted by Cherubino. He was also employed by Clement VIII, to paint the sacristy of St. John of Lateran, and, in conjunction with his brothers, to decorate the Sala Clementina in the Vatican. For this work, which was commenced in 1595 and completed in 1598, the two painters (Alessandro had died during the course of execution) received 3050 scudi. Giovanni Alberti also laboured in his native town, in Mantua, Perugia, Florence, and elsewhere. He died at Rome in 1601. His portrait is placed in the academy of St Luke, and another in the Uffizi at Florence.
d770	Caminada retired in 1899, and become a private detective, an estate agent, and a Manchester city councillor for Openshaw between 1907 and 1910. He died in 1914 at his home in Moss Side at the age of 70, as a result of injuries he had received in a bus accident in North Wales the previous year. He is buried in Manchester's Southern Cemetery.
d771	In Gallinas, Blanco built himself a private kingdom with storehouses on an island, his office on another island, and houses for his African wives on yet a third island. Slaves awaiting shipment were housed on the islands of Taro and Kamasun. In 1838, Blanco left Africa for Cuba and went to Barcelona, all the time trading in slaves. He left Gallinas just before most of the La Amistad Africans reached his stockades, but he left behind a network of employees to continue his business. It is likely that some of them handled the Amistad Africans. At any rate, he played a vital part in the development of the slave trade in this region. Blanco's business finally collapsed in 1848, and in 1854 he died in Genoa.
d772	Rentschler remained as president of United Aircraft until his death on April 25, 1956 in Boca Raton, Florida. He is buried at Fairview Cemetery in Hartford.
d774	Gray was chairman of the executive of the Liberal Party organization for six years and was a member of the Council of the Liberal Party at the time of his death. He died at his home in Wheathampstead in Hertfordshire.
d775	Coles died on his plantation, Cole's Hill, near Chatham, Virginia in 1813 and was buried in the family cemetery there. His son, Walter Coles, also served in the House of Representatives.
d776	In 1935, President Franklin Delano Roosevelt appointed McDuffie to a seat on the U.S. District Court for the Southern District of Alabama. He served on that court until his death in Mobile, Alabama on November 1, 1950. He is interred in Pine Crest Cemetery.
d777	Johann Friedrich Dietler was born at Solothurn, in Switzerland, in 1804, and was instructed in the rudiments of art by German, a drawing-master of that town. He distinguished himself as a portrait painter, and visited Paris and Italy, remaining also some time at Geneva; but he finally settled at Berne, where he died in 1874. He painted for the town of Solothurn 'The Burgomaster Wengi before the Cannon. '
